{
    "phase":  "6C-H11",
    "summary":  {
                    "requiresRerun":  0,
                    "partialCount":  0,
                    "exactCount":  1,
                    "strongCount":  0,
                    "blockerCount":  0,
                    "weakCount":  0,
                    "totalMappings":  1,
                    "invalidCount":  0
                },
    "runId":  "h11-fixture",
    "aliasMappings":  [
                          {
                              "sourceEvidence":  [

                                                 ],
                              "rerunRequired":  false,
                              "actualScenarioId":  "s8",
                              "intendedScenarioId":  "s8",
                              "requiresDirectScenario":  false,
                              "intendedInvariant":  "ir_8",
                              "negativeId":  "neg-8",
                              "equivalenceJustification":  "IDs match but no source evidence provided.",
                              "acceptedForClosure":  true,
                              "aliasStrength":  "EXACT"
                          }
                      ],
    "createdAt":  "2026-06-22T23:16:40.5062924+08:00"
}
